{"$id":"pe4-ha-association-production-dependency-correction.schema.json","$schema":"https://json-schema.org/draft/2020-12/schema","additionalProperties":false,"properties":{"adapter_executed":{"const":false},"adapter_local_imports":{"items":false,"maxItems":3,"minItems":3,"prefixItems":[{"const":"core.config"},{"const":"core.compatibility"},{"const":"core.state"}],"type":"array"},"additional_mandatory_local_dependency_found":{"const":false},"additive_target_count":{"const":9},"compatibility_consumed_closure":{"items":false,"maxItems":9,"minItems":9,"prefixItems":[{"const":"_date"},{"const":"_update_status"},{"const":"assess"},{"const":"diagnostic"},{"const":"load_registry"},{"const":"safe_version"},{"const":"state_lock"},{"const":"summarize"},{"const":"update_status"}],"type":"array"},"compatibility_consumed_constants":{"items":false,"maxItems":2,"minItems":2,"prefixItems":[{"const":"STATES"},{"const":"GOOD"}],"type":"array"},"compatibility_consumed_functions":{"items":false,"maxItems":4,"minItems":4,"prefixItems":[{"const":"safe_version"},{"const":"load_registry"},{"const":"assess"},{"const":"update_status"}],"type":"array"},"compatibility_introduced_commit":{"const":"8187114c7233be82b188f0fc03b93a022787e7bb"},"compatibility_introduced_subject":{"const":"HIOC: add compatibility resilience and drift diagnostics"},"compatibility_module":{"additionalProperties":false,"properties":{"classification":{"const":"A_NEW_FILE_TO_DEPLOY"},"git_blob":{"const":"1ba46d4ebf3819e2fa3ee9365e5b0088ba0b4a1a"},"group":{"const":"jazofv1"},"mode":{"const":"0644"},"owner":{"const":"jazofv1"},"path":{"const":"pi4/lib/hioc/core/compatibility.py"},"policy":{"const":"ABSENT_INSTALL_EXACT_PRESERVE_DIFFERENT_FAIL_CLOSED"},"production":{"const":"/home/jazofv1/hioc/pi4/lib/hioc/core/compatibility.py"},"sha256":{"const":"713c292c09282f3be524bc8a2090de43cf0fb78a81b3c71eed143b7a0d68e952"},"source":{"const":"/home/jazofv1/hioc-release-source/pi4/lib/hioc/core/compatibility.py"}},"required":["classification","git_blob","group","mode","owner","path","policy","production","sha256","source"],"type":"object"},"compatibility_mqtt_observation_reachable":{"const":false},"compatibility_state_explanation":{"const":"PE4_0B_2B_SOURCE_TREE_WRITER"},"compatibility_state_mutation_by_deployment":{"const":false},"current_platform_status_sha256":{"const":"55f75b7945b02f5d23759cf277b0e008a407d9d71e51a9c12b40a3cd1855c733"},"deployment_transaction":{"const":"NOT_STARTED"},"ha_authentication_attempted":{"const":false},"ha_network_attempted":{"const":false},"negative_evidence":{"additionalProperties":false,"properties":{"adapter_execution":{"const":false},"deployment":{"const":false},"ha_access":{"const":false},"mqtt":{"const":false},"pi3_access_by_codex":{"const":false},"pi5_access_by_codex":{"const":false},"platform_status_execution":{"const":false},"production_mutation":{"const":false},"public_projection":{"const":false},"real_credential_access":{"const":false},"rollback":{"const":false},"runtime_mutation":{"const":false},"scheduler_activation":{"const":false},"ssh":{"const":false}},"required":["adapter_execution","deployment","ha_access","mqtt","pi3_access_by_codex","pi5_access_by_codex","platform_status_execution","production_mutation","public_projection","real_credential_access","rollback","runtime_mutation","scheduler_activation","ssh"],"type":"object"},"new_classification":{"const":"A_NEW_FILE_TO_DEPLOY"},"next_task":{"const":"PE-4 Home Assistant Association Adapter Deployment Execution"},"old_classification":{"const":"B_EXISTING_EXACT_DEPENDENCY"},"operator_evidence":{"additionalProperties":false,"properties":{"attempt":{"const":3},"compatibility_state_mtime":{"const":"2026-10-06 12:25:11.049013060 -0600"},"compatibility_state_present":{"const":true},"compatibility_state_size":{"const":39536},"existing_platform_cron":{"const":"17 3 * * * flock -n /tmp/hioc-platform-status.lock /home/jazofv1/hioc/pi4/bin/hioc-platform-status.py"},"five_existing_dependencies":{"const":"PRESENT_EXACT"},"label":{"const":"OPERATOR_SUPPLIED_PRODUCTION_EVIDENCE"},"missing_dependency":{"const":"pi4/lib/hioc/core/compatibility.py"},"production_platform_generation":{"const":"PRE_COMPATIBILITY_KNOWN_VERSION"},"production_platform_metadata":{"additionalProperties":false,"properties":{"group":{"const":"jazofv1"},"mode":{"const":"0755"},"mtime":{"const":"2026-07-12 22:35:52.374432005 -0600"},"owner":{"const":"jazofv1"}},"required":["group","mode","mtime","owner"],"type":"object"},"production_platform_status_sha256":{"const":"b65464e722bf9a4da0004ecf3bb05e4105f345a87c62405ce92d97c6298b2af8"},"production_presence":{"const":"ABSENT"},"provenance":{"const":"OPERATOR_SUPPLIED"},"supplied_compatibility_sha256_text":{"const":"713c292c09282f5e936bc8a2090de43cf0fb78a81b3c71eed143b7a0d68e952"}},"required":["attempt","compatibility_state_mtime","compatibility_state_present","compatibility_state_size","existing_platform_cron","five_existing_dependencies","label","missing_dependency","production_platform_generation","production_platform_metadata","production_platform_status_sha256","production_presence","provenance","supplied_compatibility_sha256_text"],"type":"object"},"platform_cron_mutation":{"const":false},"production_deployment":{"const":"NOT_STARTED"},"production_failure":{"const":"DEPENDENCY_DRIFT"},"production_installation_of_correction_record":{"const":false},"production_mutation":{"const":false},"production_platform_status_deployment":{"const":false},"record_type":{"const":"PE4_HA_ASSOCIATION_PRODUCTION_DEPENDENCY_CORRECTION"},"required_existing_dependency_count":{"const":5},"rollback":{"const":"NOT_PERFORMED"},"runtime_contract_consumption":{"const":false},"runtime_governance_count":{"const":6},"runtime_mutation":{"const":false},"scheduler_deployment":{"const":"NOT_STARTED"},"schema_version":{"const":"1.0"},"source_binding_parent":{"const":"84635cb88380c590d2adfb655c37afd2118c629f"},"source_binding_subject":{"const":"PE-4: correct production compatibility dependency"},"source_identity_resolution":{"const":"SUPPLIED_SHA_TEXT_HAS_63_CHARACTERS_EXACT_REQUESTED_GIT_BLOB_VERIFIES_EXISTING_64_CHARACTER_SHA256"},"source_tree_writer":{"additionalProperties":false,"properties":{"does_not_prove_production_module_presence":{"const":true},"function":{"const":"record_compatibility"},"import_root":{"const":"/home/jazofv1/hioc-release-source/pi4/lib"},"path":{"const":"tools/hioc-pe4-ha-registry-discovery.py"},"state_root":{"const":"/home/jazofv1/hioc/state/platform"}},"required":["does_not_prove_production_module_presence","function","import_root","path","state_root"],"type":"object"},"sources":{"additionalProperties":false,"properties":{"compatibility":{"additionalProperties":false,"properties":{"git_blob":{"const":"1ba46d4ebf3819e2fa3ee9365e5b0088ba0b4a1a"},"path":{"const":"pi4/lib/hioc/core/compatibility.py"},"sha256":{"const":"713c292c09282f3be524bc8a2090de43cf0fb78a81b3c71eed143b7a0d68e952"}},"required":["git_blob","path","sha256"],"type":"object"},"deployment_helper":{"additionalProperties":false,"properties":{"git_blob":{"const":"f18f49aafff9071b850bb4203a6017f49a1566d5"},"path":{"const":"tools/hioc-pe4-ha-association-deploy.py"},"sha256":{"const":"9f1903c99206348722584a976c57ac9e1bcbf53178e0c8d472719687259a48da"}},"required":["git_blob","path","sha256"],"type":"object"},"entrypoint":{"additionalProperties":false,"properties":{"git_blob":{"const":"2864361fac7cd48e947dac1e4e40aeeeb525adef"},"path":{"const":"pi4/bin/hioc-home-assistant-association.py"},"sha256":{"const":"005fae482a4e2c42b48bfb991abf14ddf1d9de60f81169a2ed1573a767958b8c"}},"required":["git_blob","path","sha256"],"type":"object"},"module":{"additionalProperties":false,"properties":{"git_blob":{"const":"e71e4c45e21e9f1a25298471b48387cb19f53e1f"},"path":{"const":"pi4/lib/hioc/home_assistant_association.py"},"sha256":{"const":"9a9be5812f3481146de7546875320eb6adec65ca5a2b3230ff5fec378892c7c1"}},"required":["git_blob","path","sha256"],"type":"object"}},"required":["compatibility","deployment_helper","entrypoint","module"],"type":"object"},"starting_commit":{"const":"84635cb88380c590d2adfb655c37afd2118c629f"},"state_transitive_local_import":{"const":"core.schemas"},"status":{"const":"PASS_CLOSED"},"validation":{"additionalProperties":false,"properties":{"adapter_regression":{"const":73},"focused_tests":{"const":83},"kind":{"const":"REPOSITORY_ONLY_SYNTHETIC"},"other_regression":{"const":275},"production_dependency_tests":{"const":14},"runtime_correction_tests":{"const":8},"skip_reason":{"const":"Existing release rsync unavailable on Windows"},"total_passed":{"const":452},"total_run":{"const":453},"total_skipped":{"const":1}},"required":["adapter_regression","focused_tests","kind","other_regression","production_dependency_tests","runtime_correction_tests","skip_reason","total_passed","total_run","total_skipped"],"type":"object"}},"required":["adapter_executed","adapter_local_imports","additional_mandatory_local_dependency_found","additive_target_count","compatibility_consumed_closure","compatibility_consumed_constants","compatibility_consumed_functions","compatibility_introduced_commit","compatibility_introduced_subject","compatibility_module","compatibility_mqtt_observation_reachable","compatibility_state_explanation","compatibility_state_mutation_by_deployment","current_platform_status_sha256","deployment_transaction","ha_authentication_attempted","ha_network_attempted","negative_evidence","new_classification","next_task","old_classification","operator_evidence","platform_cron_mutation","production_deployment","production_failure","production_installation_of_correction_record","production_mutation","production_platform_status_deployment","record_type","required_existing_dependency_count","rollback","runtime_contract_consumption","runtime_governance_count","runtime_mutation","scheduler_deployment","schema_version","source_binding_parent","source_binding_subject","source_identity_resolution","source_tree_writer","sources","starting_commit","state_transitive_local_import","status","validation"],"type":"object"}
