{"adapter_executed":false,"adapter_local_imports":["core.config","core.compatibility","core.state"],"additional_mandatory_local_dependency_found":false,"additive_target_count":9,"compatibility_consumed_closure":["_date","_update_status","assess","diagnostic","load_registry","safe_version","state_lock","summarize","update_status"],"compatibility_consumed_constants":["STATES","GOOD"],"compatibility_consumed_functions":["safe_version","load_registry","assess","update_status"],"compatibility_introduced_commit":"8187114c7233be82b188f0fc03b93a022787e7bb","compatibility_introduced_subject":"HIOC: add compatibility resilience and drift diagnostics","compatibility_module":{"classification":"A_NEW_FILE_TO_DEPLOY","git_blob":"1ba46d4ebf3819e2fa3ee9365e5b0088ba0b4a1a","group":"jazofv1","mode":"0644","owner":"jazofv1","path":"pi4/lib/hioc/core/compatibility.py","policy":"ABSENT_INSTALL_EXACT_PRESERVE_DIFFERENT_FAIL_CLOSED","production":"/home/jazofv1/hioc/pi4/lib/hioc/core/compatibility.py","sha256":"713c292c09282f3be524bc8a2090de43cf0fb78a81b3c71eed143b7a0d68e952","source":"/home/jazofv1/hioc-release-source/pi4/lib/hioc/core/compatibility.py"},"compatibility_mqtt_observation_reachable":false,"compatibility_state_explanation":"PE4_0B_2B_SOURCE_TREE_WRITER","compatibility_state_mutation_by_deployment":false,"current_platform_status_sha256":"55f75b7945b02f5d23759cf277b0e008a407d9d71e51a9c12b40a3cd1855c733","deployment_transaction":"NOT_STARTED","ha_authentication_attempted":false,"ha_network_attempted":false,"negative_evidence":{"adapter_execution":false,"deployment":false,"ha_access":false,"mqtt":false,"pi3_access_by_codex":false,"pi5_access_by_codex":false,"platform_status_execution":false,"production_mutation":false,"public_projection":false,"real_credential_access":false,"rollback":false,"runtime_mutation":false,"scheduler_activation":false,"ssh":false},"new_classification":"A_NEW_FILE_TO_DEPLOY","next_task":"PE-4 Home Assistant Association Adapter Deployment Execution","old_classification":"B_EXISTING_EXACT_DEPENDENCY","operator_evidence":{"attempt":3,"compatibility_state_mtime":"2026-10-06 12:25:11.049013060 -0600","compatibility_state_present":true,"compatibility_state_size":39536,"existing_platform_cron":"17 3 * * * flock -n /tmp/hioc-platform-status.lock /home/jazofv1/hioc/pi4/bin/hioc-platform-status.py","five_existing_dependencies":"PRESENT_EXACT","label":"OPERATOR_SUPPLIED_PRODUCTION_EVIDENCE","missing_dependency":"pi4/lib/hioc/core/compatibility.py","production_platform_generation":"PRE_COMPATIBILITY_KNOWN_VERSION","production_platform_metadata":{"group":"jazofv1","mode":"0755","mtime":"2026-07-12 22:35:52.374432005 -0600","owner":"jazofv1"},"production_platform_status_sha256":"b65464e722bf9a4da0004ecf3bb05e4105f345a87c62405ce92d97c6298b2af8","production_presence":"ABSENT","provenance":"OPERATOR_SUPPLIED","supplied_compatibility_sha256_text":"713c292c09282f5e936bc8a2090de43cf0fb78a81b3c71eed143b7a0d68e952"},"platform_cron_mutation":false,"production_deployment":"NOT_STARTED","production_failure":"DEPENDENCY_DRIFT","production_installation_of_correction_record":false,"production_mutation":false,"production_platform_status_deployment":false,"record_type":"PE4_HA_ASSOCIATION_PRODUCTION_DEPENDENCY_CORRECTION","required_existing_dependency_count":5,"rollback":"NOT_PERFORMED","runtime_contract_consumption":false,"runtime_governance_count":6,"runtime_mutation":false,"scheduler_deployment":"NOT_STARTED","schema_version":"1.0","source_binding_parent":"84635cb88380c590d2adfb655c37afd2118c629f","source_binding_subject":"PE-4: correct production compatibility dependency","source_identity_resolution":"SUPPLIED_SHA_TEXT_HAS_63_CHARACTERS_EXACT_REQUESTED_GIT_BLOB_VERIFIES_EXISTING_64_CHARACTER_SHA256","source_tree_writer":{"does_not_prove_production_module_presence":true,"function":"record_compatibility","import_root":"/home/jazofv1/hioc-release-source/pi4/lib","path":"tools/hioc-pe4-ha-registry-discovery.py","state_root":"/home/jazofv1/hioc/state/platform"},"sources":{"compatibility":{"git_blob":"1ba46d4ebf3819e2fa3ee9365e5b0088ba0b4a1a","path":"pi4/lib/hioc/core/compatibility.py","sha256":"713c292c09282f3be524bc8a2090de43cf0fb78a81b3c71eed143b7a0d68e952"},"deployment_helper":{"git_blob":"f18f49aafff9071b850bb4203a6017f49a1566d5","path":"tools/hioc-pe4-ha-association-deploy.py","sha256":"9f1903c99206348722584a976c57ac9e1bcbf53178e0c8d472719687259a48da"},"entrypoint":{"git_blob":"2864361fac7cd48e947dac1e4e40aeeeb525adef","path":"pi4/bin/hioc-home-assistant-association.py","sha256":"005fae482a4e2c42b48bfb991abf14ddf1d9de60f81169a2ed1573a767958b8c"},"module":{"git_blob":"e71e4c45e21e9f1a25298471b48387cb19f53e1f","path":"pi4/lib/hioc/home_assistant_association.py","sha256":"9a9be5812f3481146de7546875320eb6adec65ca5a2b3230ff5fec378892c7c1"}},"starting_commit":"84635cb88380c590d2adfb655c37afd2118c629f","state_transitive_local_import":"core.schemas","status":"PASS_CLOSED","validation":{"adapter_regression":73,"focused_tests":83,"kind":"REPOSITORY_ONLY_SYNTHETIC","other_regression":275,"production_dependency_tests":14,"runtime_correction_tests":8,"skip_reason":"Existing release rsync unavailable on Windows","total_passed":452,"total_run":453,"total_skipped":1}}
